[
  {
    "id": "j001",
    "char": "日",
    "meaning": "hari, matahari",
    "onyomi": [
      "ニチ",
      "ジツ"
    ],
    "kunyomi": [
      "ひ",
      "か"
    ],
    "strokes": 4,
    "examples": [
      {
        "word": "日曜日",
        "kana": "にちようび",
        "meaning": "hari Minggu"
      },
      {
        "word": "毎日",
        "kana": "まいにち",
        "meaning": "setiap hari"
      }
    ],
    "reviewed": false
  },
  {
    "id": "j002",
    "char": "月",
    "meaning": "bulan",
    "onyomi": [
      "ゲツ",
      "ガツ"
    ],
    "kunyomi": [
      "つき"
    ],
    "strokes": 4,
    "examples": [
      {
        "word": "月曜日",
        "kana": "げつようび",
        "meaning": "hari Senin"
      },
      {
        "word": "今月",
        "kana": "こんげつ",
        "meaning": "bulan ini"
      }
    ],
    "reviewed": false
  },
  {
    "id": "j003",
    "char": "火",
    "meaning": "api",
    "onyomi": [
      "カ"
    ],
    "kunyomi": [
      "ひ"
    ],
    "strokes": 4,
    "examples": [
      {
        "word": "火曜日",
        "kana": "かようび",
        "meaning": "hari Selasa"
      },
      {
        "word": "火",
        "kana": "ひ",
        "meaning": "api"
      }
    ],
    "reviewed": false
  },
  {
    "id": "j004",
    "char": "水",
    "meaning": "air",
    "onyomi": [
      "スイ"
    ],
    "kunyomi": [
      "みず"
    ],
    "strokes": 4,
    "examples": [
      {
        "word": "水曜日",
        "kana": "すいようび",
        "meaning": "hari Rabu"
      },
      {
        "word": "水",
        "kana": "みず",
        "meaning": "air"
      }
    ],
    "reviewed": false
  },
  {
    "id": "j005",
    "char": "木",
    "meaning": "pohon, kayu",
    "onyomi": [
      "モク",
      "ボク"
    ],
    "kunyomi": [
      "き"
    ],
    "strokes": 4,
    "examples": [
      {
        "word": "木曜日",
        "kana": "もくようび",
        "meaning": "hari Kamis"
      },
      {
        "word": "木",
        "kana": "き",
        "meaning": "pohon"
      }
    ],
    "reviewed": false
  },
  {
    "id": "j006",
    "char": "金",
    "meaning": "emas, uang, logam",
    "onyomi": [
      "キン",
      "コン"
    ],
    "kunyomi": [
      "かね"
    ],
    "strokes": 8,
    "examples": [
      {
        "word": "金曜日",
        "kana": "きんようび",
        "meaning": "hari Jumat"
      },
      {
        "word": "お金",
        "kana": "おかね",
        "meaning": "uang"
      }
    ],
    "reviewed": false
  },
  {
    "id": "j007",
    "char": "土",
    "meaning": "tanah",
    "onyomi": [
      "ド",
      "ト"
    ],
    "kunyomi": [
      "つち"
    ],
    "strokes": 3,
    "examples": [
      {
        "word": "土曜日",
        "kana": "どようび",
        "meaning": "hari Sabtu"
      },
      {
        "word": "土",
        "kana": "つち",
        "meaning": "tanah"
      }
    ],
    "reviewed": false
  },
  {
    "id": "j008",
    "char": "一",
    "meaning": "satu",
    "onyomi": [
      "イチ",
      "イツ"
    ],
    "kunyomi": [
      "ひと"
    ],
    "strokes": 1,
    "examples": [
      {
        "word": "一月",
        "kana": "いちがつ",
        "meaning": "bulan Januari"
      },
      {
        "word": "一つ",
        "kana": "ひとつ",
        "meaning": "satu buah"
      }
    ],
    "reviewed": false
  },
  {
    "id": "j009",
    "char": "二",
    "meaning": "dua",
    "onyomi": [
      "ニ"
    ],
    "kunyomi": [
      "ふた"
    ],
    "strokes": 2,
    "examples": [
      {
        "word": "二月",
        "kana": "にがつ",
        "meaning": "bulan Februari"
      },
      {
        "word": "二人",
        "kana": "ふたり",
        "meaning": "dua orang"
      }
    ],
    "reviewed": false
  },
  {
    "id": "j010",
    "char": "三",
    "meaning": "tiga",
    "onyomi": [
      "サン"
    ],
    "kunyomi": [
      "み"
    ],
    "strokes": 3,
    "examples": [
      {
        "word": "三月",
        "kana": "さんがつ",
        "meaning": "bulan Maret"
      },
      {
        "word": "三つ",
        "kana": "みっつ",
        "meaning": "tiga buah"
      }
    ],
    "reviewed": false
  },
  {
    "id": "j011",
    "char": "四",
    "meaning": "empat",
    "onyomi": [
      "シ"
    ],
    "kunyomi": [
      "よ",
      "よん"
    ],
    "strokes": 5,
    "examples": [
      {
        "word": "四月",
        "kana": "しがつ",
        "meaning": "bulan April"
      },
      {
        "word": "四つ",
        "kana": "よっつ",
        "meaning": "empat buah"
      }
    ],
    "reviewed": false
  },
  {
    "id": "j012",
    "char": "五",
    "meaning": "lima",
    "onyomi": [
      "ゴ"
    ],
    "kunyomi": [
      "いつ"
    ],
    "strokes": 4,
    "examples": [
      {
        "word": "五月",
        "kana": "ごがつ",
        "meaning": "bulan Mei"
      },
      {
        "word": "五つ",
        "kana": "いつつ",
        "meaning": "lima buah"
      }
    ],
    "reviewed": false
  },
  {
    "id": "j013",
    "char": "六",
    "meaning": "enam",
    "onyomi": [
      "ロク"
    ],
    "kunyomi": [
      "む"
    ],
    "strokes": 4,
    "examples": [
      {
        "word": "六月",
        "kana": "ろくがつ",
        "meaning": "bulan Juni"
      },
      {
        "word": "六つ",
        "kana": "むっつ",
        "meaning": "enam buah"
      }
    ],
    "reviewed": false
  },
  {
    "id": "j014",
    "char": "七",
    "meaning": "tujuh",
    "onyomi": [
      "シチ"
    ],
    "kunyomi": [
      "なな"
    ],
    "strokes": 2,
    "examples": [
      {
        "word": "七月",
        "kana": "しちがつ",
        "meaning": "bulan Juli"
      },
      {
        "word": "七つ",
        "kana": "ななつ",
        "meaning": "tujuh buah"
      }
    ],
    "reviewed": false
  },
  {
    "id": "j015",
    "char": "八",
    "meaning": "delapan",
    "onyomi": [
      "ハチ"
    ],
    "kunyomi": [
      "や"
    ],
    "strokes": 2,
    "examples": [
      {
        "word": "八月",
        "kana": "はちがつ",
        "meaning": "bulan Agustus"
      },
      {
        "word": "八つ",
        "kana": "やっつ",
        "meaning": "delapan buah"
      }
    ],
    "reviewed": false
  },
  {
    "id": "j016",
    "char": "九",
    "meaning": "sembilan",
    "onyomi": [
      "キュウ",
      "ク"
    ],
    "kunyomi": [
      "ここの"
    ],
    "strokes": 2,
    "examples": [
      {
        "word": "九月",
        "kana": "くがつ",
        "meaning": "bulan September"
      },
      {
        "word": "九つ",
        "kana": "ここのつ",
        "meaning": "sembilan buah"
      }
    ],
    "reviewed": false
  },
  {
    "id": "j017",
    "char": "十",
    "meaning": "sepuluh",
    "onyomi": [
      "ジュウ",
      "ジッ"
    ],
    "kunyomi": [
      "とお"
    ],
    "strokes": 2,
    "examples": [
      {
        "word": "十月",
        "kana": "じゅうがつ",
        "meaning": "bulan Oktober"
      },
      {
        "word": "十",
        "kana": "とお",
        "meaning": "sepuluh buah"
      }
    ],
    "reviewed": false
  },
  {
    "id": "j018",
    "char": "百",
    "meaning": "seratus",
    "onyomi": [
      "ヒャク"
    ],
    "kunyomi": [],
    "strokes": 6,
    "examples": [
      {
        "word": "百円",
        "kana": "ひゃくえん",
        "meaning": "100 yen"
      },
      {
        "word": "三百",
        "kana": "さんびゃく",
        "meaning": "300"
      }
    ],
    "reviewed": false
  },
  {
    "id": "j019",
    "char": "千",
    "meaning": "seribu",
    "onyomi": [
      "セン"
    ],
    "kunyomi": [
      "ち"
    ],
    "strokes": 3,
    "examples": [
      {
        "word": "千円",
        "kana": "せんえん",
        "meaning": "1.000 yen"
      },
      {
        "word": "三千",
        "kana": "さんぜん",
        "meaning": "3.000"
      }
    ],
    "reviewed": false
  },
  {
    "id": "j020",
    "char": "万",
    "meaning": "sepuluh ribu",
    "onyomi": [
      "マン",
      "バン"
    ],
    "kunyomi": [],
    "strokes": 3,
    "examples": [
      {
        "word": "一万円",
        "kana": "いちまんえん",
        "meaning": "10.000 yen"
      },
      {
        "word": "万年筆",
        "kana": "まんねんひつ",
        "meaning": "pulpen tinta"
      }
    ],
    "reviewed": false
  },
  {
    "id": "j021",
    "char": "円",
    "meaning": "yen, bulat",
    "onyomi": [
      "エン"
    ],
    "kunyomi": [
      "まる"
    ],
    "strokes": 4,
    "examples": [
      {
        "word": "千円",
        "kana": "せんえん",
        "meaning": "1.000 yen"
      },
      {
        "word": "円",
        "kana": "えん",
        "meaning": "yen"
      }
    ],
    "reviewed": false
  },
  {
    "id": "j022",
    "char": "年",
    "meaning": "tahun",
    "onyomi": [
      "ネン"
    ],
    "kunyomi": [
      "とし"
    ],
    "strokes": 6,
    "examples": [
      {
        "word": "今年",
        "kana": "ことし",
        "meaning": "tahun ini"
      },
      {
        "word": "来年",
        "kana": "らいねん",
        "meaning": "tahun depan"
      }
    ],
    "reviewed": false
  },
  {
    "id": "j023",
    "char": "時",
    "meaning": "waktu, jam",
    "onyomi": [
      "ジ"
    ],
    "kunyomi": [
      "とき"
    ],
    "strokes": 10,
    "examples": [
      {
        "word": "時間",
        "kana": "じかん",
        "meaning": "waktu"
      },
      {
        "word": "一時",
        "kana": "いちじ",
        "meaning": "jam satu"
      }
    ],
    "reviewed": false
  },
  {
    "id": "j024",
    "char": "分",
    "meaning": "menit, bagian, paham",
    "onyomi": [
      "ブン",
      "フン",
      "ブ"
    ],
    "kunyomi": [
      "わ"
    ],
    "strokes": 4,
    "examples": [
      {
        "word": "五分",
        "kana": "ごふん",
        "meaning": "lima menit"
      },
      {
        "word": "分かる",
        "kana": "わかる",
        "meaning": "mengerti"
      }
    ],
    "reviewed": false
  },
  {
    "id": "j025",
    "char": "半",
    "meaning": "setengah",
    "onyomi": [
      "ハン"
    ],
    "kunyomi": [
      "なか"
    ],
    "strokes": 5,
    "examples": [
      {
        "word": "半分",
        "kana": "はんぶん",
        "meaning": "setengah"
      },
      {
        "word": "二時半",
        "kana": "にじはん",
        "meaning": "jam setengah tiga"
      }
    ],
    "reviewed": false
  },
  {
    "id": "j026",
    "char": "午",
    "meaning": "tengah hari",
    "onyomi": [
      "ゴ"